{
  "version": "flash-backup-v2",
  "exportedAt": "2026-09-05T00:00:00.000Z",
  "appVersion": "0.1.0",
  "notes": "虚构示例，不含用户数据",
  "schemas": {
    "logs": 1,
    "emotions": 1,
    "tasks": 1
  },
  "data": {
    "logs": [
      {
        "id": "11111111-1111-4111-8111-111111111111",
        "content": "文件日志胜出",
        "colorTag": "daily",
        "category": "log",
        "importance": 2,
        "createdAt": "2026-09-04T02:00:00.000Z",
        "recordDate": "2026-09-04"
      },
      {
        "id": "aaaaaaaa-aaaa-4aaa-8aaa-aaaaaaaaaaaa",
        "content": "本机独有",
        "colorTag": "daily",
        "category": "log",
        "importance": 2,
        "createdAt": "2026-09-04T02:00:00.000Z",
        "recordDate": "2026-09-04"
      },
      {
        "id": "bbbbbbbb-bbbb-4bbb-8bbb-bbbbbbbbbbbb",
        "content": "文件日志胜出",
        "colorTag": "daily",
        "category": "log",
        "importance": 2,
        "createdAt": "2026-09-04T02:00:00.000Z",
        "recordDate": "2026-09-04"
      }
    ],
    "emotions": [
      {
        "id": "22222222-2222-4222-8222-222222222222",
        "level": -1,
        "subEmotion": "sad",
        "note": "项目延期，调整计划后再出发",
        "status": null,
        "createdAt": "2026-09-04T03:00:00.000Z",
        "recordDate": "2026-09-04"
      }
    ],
    "tasks": [
      {
        "id": "33333333-3333-4333-8333-333333333333",
        "title": "本机较新",
        "notes": "包含经理说明和技术契约",
        "colorTag": "urgent",
        "importance": 3,
        "due": {
          "kind": "dateTime",
          "at": "2026-09-06T01:00:00.000Z",
          "timeZone": "Asia/Shanghai"
        },
        "reminderAt": "2026-09-06T00:30:00.000Z",
        "completedAt": null,
        "createdAt": "2026-09-04T00:00:00.000Z",
        "updatedAt": "2026-09-05T01:00:00.000Z"
      },
      {
        "id": "44444444-4444-4444-8444-444444444444",
        "title": "相同时文件胜出",
        "colorTag": "memo",
        "importance": 0,
        "due": {
          "kind": "allDay",
          "date": "2026-09-07"
        },
        "createdAt": "2026-09-04T00:00:00.000Z",
        "updatedAt": "2026-09-04T00:00:00.000Z"
      },
      {
        "id": "cccccccc-cccc-4ccc-8ccc-cccccccccccc",
        "title": "文件较新",
        "colorTag": "memo",
        "importance": 0,
        "due": {
          "kind": "allDay",
          "date": "2026-09-07"
        },
        "createdAt": "2026-09-04T00:00:00.000Z",
        "updatedAt": "2026-09-06T00:00:00.000Z"
      },
      {
        "id": "dddddddd-dddd-4ddd-8ddd-dddddddddddd",
        "title": "本机独有任务",
        "colorTag": "memo",
        "importance": 0,
        "due": {
          "kind": "allDay",
          "date": "2026-09-07"
        },
        "createdAt": "2026-09-04T00:00:00.000Z",
        "updatedAt": "2026-09-04T00:00:00.000Z"
      },
      {
        "id": "eeeeeeee-eeee-4eee-8eee-eeeeeeeeeeee",
        "title": "文件独有任务",
        "colorTag": "memo",
        "importance": 0,
        "due": {
          "kind": "allDay",
          "date": "2026-09-07"
        },
        "createdAt": "2026-09-04T00:00:00.000Z",
        "updatedAt": "2026-09-04T00:00:00.000Z"
      }
    ]
  }
}
