{
  "version": "flash-backup-v2",
  "exportedAt": "2026-10-05T00:00:00.000Z",
  "appVersion": "0.1.0",
  "notes": "分区 schema 2 虚构示例：收藏、情绪强度、任务来源关联；不含用户数据",
  "schemas": { "logs": 2, "emotions": 2, "tasks": 2 },
  "data": {
    "logs": [
      {
        "id": "11111111-1111-4111-8111-111111111111",
        "content": "完成跨端协议讨论",
        "colorTag": "daily",
        "category": "log",
        "importance": 2,
        "isFavorite": true,
        "createdAt": "2026-09-04T02:00:00.000Z",
        "recordDate": "2026-09-04"
      },
      {
        "id": "55555555-5555-4555-8555-555555555555",
        "content": "想做一个新的 App 概念",
        "colorTag": "inspiration",
        "category": "idea",
        "importance": 0,
        "isFavorite": null,
        "createdAt": "2026-09-04T04:00:00.000Z",
        "recordDate": "2026-09-04"
      }
    ],
    "emotions": [
      {
        "id": "22222222-2222-4222-8222-222222222222",
        "level": -1,
        "subEmotion": "sad",
        "note": "项目延期，调整计划后再出发",
        "status": null,
        "intensity": 4,
        "isFavorite": false,
        "createdAt": "2026-09-04T03:00:00.000Z",
        "recordDate": "2026-09-04"
      },
      {
        "id": "66666666-6666-4666-8666-666666666666",
        "level": 2,
        "createdAt": "2026-09-04T05:00:00.000Z",
        "recordDate": "2026-09-04"
      }
    ],
    "tasks": [
      {
        "id": "33333333-3333-4333-8333-333333333333",
        "title": "提交协议首稿",
        "notes": "包含经理说明和技术契约",
        "colorTag": "urgent",
        "importance": 3,
        "due": { "kind": "dateTime", "at": "2026-09-06T01:00:00.000Z", "timeZone": "Asia/Shanghai" },
        "sourceLogId": "55555555-5555-4555-8555-555555555555",
        "isFavorite": true,
        "reminderAt": "2026-09-06T00:30:00.000Z",
        "completedAt": null,
        "createdAt": "2026-09-04T00:00:00.000Z",
        "updatedAt": "2026-09-05T00:00:00.000Z"
      },
      {
        "id": "44444444-4444-4444-8444-444444444444",
        "title": "整理验收意见",
        "colorTag": "memo",
        "importance": 0,
        "due": { "kind": "allDay", "date": "2026-09-07" },
        "createdAt": "2026-09-04T00:00:00.000Z",
        "updatedAt": "2026-09-04T00:00:00.000Z"
      }
    ]
  }
}
