{"version":"flash-backup-v2","exportedAt":"2026-09-05T00:00:00.000Z","appVersion":"0.1.0","notes":"虚构示例，不含用户数据","schemas":{"logs":1,"emotions":1,"tasks":1},"data":{"logs":[{"id":"11111111-1111-4111-8111-111111111111","content":"完成跨端协议讨论","colorTag":"daily","category":"log","importance":2,"createdAt":"2026-09-04T02:00:00.000Z","recordDate":"2026-09-04"}],"emotions":[{"id":"22222222-2222-4222-8222-222222222222","level":-1,"subEmotion":"sad","note":"项目延期，调整计划后再出发","status":null,"createdAt":"2026-09-04T03:00:00.000Z","recordDate":"2026-09-04"}],"tasks":[{"id":"55555555-5555-4555-8555-000000000000","title":"提交协议首稿","notes":"包含经理说明和技术契约","colorTag":"urgent","importance":3,"due":{"kind":"dateTime","at":"2026-11-01T01:30:00-04:00","timeZone":"Asia/Shanghai"},"reminderAt":"2026-09-06T00:30:00.000Z","completedAt":null,"createdAt":"2026-09-04T00:00:00.000Z","updatedAt":"2026-09-05T00:00:00.000Z"},{"id":"55555555-5555-4555-8555-000000000001","title":"提交协议首稿","notes":"包含经理说明和技术契约","colorTag":"urgent","importance":3,"due":{"kind":"dateTime","at":"2026-11-01T01:30:00-04:00","timeZone":"America/New_York"},"reminderAt":"2026-09-06T00:30:00.000Z","completedAt":null,"createdAt":"2026-09-04T00:00:00.000Z","updatedAt":"2026-09-05T00:00:00.000Z"},{"id":"55555555-5555-4555-8555-000000000002","title":"提交协议首稿","notes":"包含经理说明和技术契约","colorTag":"urgent","importance":3,"due":{"kind":"dateTime","at":"2026-11-01T01:30:00-04:00","timeZone":"Europe/Berlin"},"reminderAt":"2026-09-06T00:30:00.000Z","completedAt":null,"createdAt":"2026-09-04T00:00:00.000Z","updatedAt":"2026-09-05T00:00:00.000Z"},{"id":"55555555-5555-4555-8555-000000000003","title":"提交协议首稿","notes":"包含经理说明和技术契约","colorTag":"urgent","importance":3,"due":{"kind":"dateTime","at":"2026-11-01T01:30:00-04:00","timeZone":"Asia/Tokyo"},"reminderAt":"2026-09-06T00:30:00.000Z","completedAt":null,"createdAt":"2026-09-04T00:00:00.000Z","updatedAt":"2026-09-05T00:00:00.000Z"},{"id":"55555555-5555-4555-8555-000000000004","title":"提交协议首稿","notes":"包含经理说明和技术契约","colorTag":"urgent","importance":3,"due":{"kind":"dateTime","at":"2026-11-01T01:30:00-04:00","timeZone":"Australia/Sydney"},"reminderAt":"2026-09-06T00:30:00.000Z","completedAt":null,"createdAt":"2026-09-04T00:00:00.000Z","updatedAt":"2026-09-05T00:00:00.000Z"}]}}
